[
  {
    "id": "dl_era_1",
    "figure": "dev_layout",
    "year": 5,
    "text": "시대 배경 5년: 배치 시험용 첫 문장이다. 두 번째 문장은 줄 바꿈과 행간을 확인하기 위해 조금 더 길게 쓴다. 세 번째 문장으로 상한을 채운다.",
    "sources": [
      "가상 데이터 — 실제 사료 아님"
    ]
  },
  {
    "id": "dl_era_2",
    "figure": "dev_layout",
    "year": 20,
    "text": "시대 배경 20년: 배치 시험용 첫 문장이다. 두 번째 문장은 줄 바꿈과 행간을 확인하기 위해 조금 더 길게 쓴다. 세 번째 문장으로 상한을 채운다.",
    "sources": [
      "가상 데이터 — 실제 사료 아님"
    ]
  },
  {
    "id": "dl_era_3",
    "figure": "dev_layout",
    "year": 45,
    "text": "시대 배경 45년: 배치 시험용 첫 문장이다. 두 번째 문장은 줄 바꿈과 행간을 확인하기 위해 조금 더 길게 쓴다. 세 번째 문장으로 상한을 채운다.",
    "sources": [
      "가상 데이터 — 실제 사료 아님"
    ]
  }
]
