[
  {
    "id": "sg_era_1",
    "figure": "sample_general",
    "year": -8,
    "text": "동하국이 강가의 새 성을 완성하고 수비병을 들인다. 서련국 조정은 변방 성채들에 군량을 더 보낸다.",
    "sources": [
      "가상 데이터 — 실제 사료 아님"
    ]
  },
  {
    "id": "sg_era_2",
    "figure": "sample_general",
    "year": 5,
    "text": "서련국에 큰 가뭄이 들어 남쪽 곡창의 수확이 절반으로 줄어든다. 조정은 변방 성채의 군량을 줄인다.",
    "sources": [
      "가상 데이터 — 실제 사료 아님"
    ]
  },
  {
    "id": "sg_era_3",
    "figure": "sample_general",
    "year": 14,
    "text": "서련국 왕이 병으로 조회에 나오지 못하는 날이 잦아진다. 수도의 대신들이 두 파로 갈라선다.",
    "sources": [
      "가상 데이터 — 실제 사료 아님"
    ]
  },
  {
    "id": "sg_era_4",
    "figure": "sample_general",
    "year": 22,
    "text": "동하국이 새 왕을 세운다. 새 왕은 국경의 강에 배다리를 놓으라고 명한다.",
    "sources": [
      "가상 데이터 — 실제 사료 아님"
    ]
  }
]
