[
  {
    "id": "dl_chr_1",
    "figure": "dev_layout",
    "year": 10,
    "text": "기록 서술 10년: 배치 시험용 첫 문장이다. 두 번째 문장은 줄 바꿈과 행간을 확인하기 위해 조금 더 길게 쓴다. 세 번째 문장으로 상한을 채운다.",
    "sources": [
      "가상 데이터 — 실제 사료 아님"
    ]
  },
  {
    "id": "dl_chr_2",
    "figure": "dev_layout",
    "year": 22,
    "text": "기록 서술 22년: 배치 시험용 첫 문장이다. 두 번째 문장은 줄 바꿈과 행간을 확인하기 위해 조금 더 길게 쓴다. 세 번째 문장으로 상한을 채운다.",
    "sources": [
      "가상 데이터 — 실제 사료 아님"
    ]
  },
  {
    "id": "dl_chr_3",
    "figure": "dev_layout",
    "year": 30,
    "text": "기록 서술 30년 (경로 A가 아닐 때만): 배치 시험용 첫 문장이다. 두 번째 문장은 줄 바꿈과 행간을 확인하기 위해 조금 더 길게 쓴다. 세 번째 문장으로 상한을 채운다.",
    "sources": [
      "가상 데이터 — 실제 사료 아님"
    ],
    "requires": {
      "flags": {
        "dl_route_a": false
      }
    }
  },
  {
    "id": "dl_chr_4",
    "figure": "dev_layout",
    "year": 28,
    "text": "기록 서술 28년 분기점 2 뒤 (같은 해 경로 A면 숨김): 배치 시험용 첫 문장이다. 두 번째 문장은 줄 바꿈과 행간을 확인하기 위해 조금 더 길게 쓴다. 세 번째 문장으로 상한을 채운다.",
    "sources": [
      "가상 데이터 — 실제 사료 아님"
    ],
    "requires": {
      "flags": {
        "dl_route_a": false
      }
    },
    "after": "dl_node_2",
    "order": 1
  },
  {
    "id": "dl_chr_5",
    "figure": "dev_layout",
    "year": 50,
    "text": "기록 서술 50년: 배치 시험용 첫 문장이다. 두 번째 문장은 줄 바꿈과 행간을 확인하기 위해 조금 더 길게 쓴다. 세 번째 문장으로 상한을 채운다.",
    "sources": [
      "가상 데이터 — 실제 사료 아님"
    ]
  }
]
