[
  {
    "id": "yi_era_e001",
    "figure": "yi_sunsin",
    "year": 1547,
    "text": "양재역 벽에 여주(女主)가 정권을 잡고 이기 등이 권세를 부린다고 비난하는 익명서가 붙는다. 조정은 이를 계기로 송인수·이약빙을 사형에 처하고, 이언적 등 29명을 안치·부처한다.",
    "sources": [
      "『명종실록』 권6, 명종 2년 9월 18일(병인) 3번째 기사"
    ]
  },
  {
    "id": "yi_era_e002",
    "figure": "yi_sunsin",
    "year": 1555,
    "text": "5월 11일 왜선 70여 척이 전라도 달량포 밖에 정박하고, 왜구가 이진포와 달량포에서 동서로 나뉘어 상륙한다.",
    "sources": [
      "『명종실록』 권18, 명종 10년 5월 16일(기유) 2번째 기사(전라도 관찰사 김주의 치계)"
    ]
  },
  {
    "id": "yi_era_e003",
    "figure": "yi_sunsin",
    "year": 1562,
    "text": "나라를 배반한 큰 도적으로 불린 임꺽정 무리가 모두 잡힌다. 명종은 이들을 잡은 남치근 등에게 품계를 한 등급씩 올려 준다.",
    "sources": [
      "『명종실록』 권28, 명종 17년 1월 8일(계사) 1번째 기사"
    ]
  },
  {
    "id": "yi_era_e004",
    "figure": "yi_sunsin",
    "year": 1565,
    "text": "문정왕후가 창덕궁 소덕당에서 죽는다.",
    "sources": [
      "『명종실록』 권31, 명종 20년 4월 6일(임신) 2번째 기사"
    ]
  },
  {
    "id": "yi_era_e005",
    "figure": "yi_sunsin",
    "year": 1567,
    "text": "명종이 경복궁 양심당에서 죽는다. 중전은 을축년(1565)에 정해 둔 대로 덕흥군의 셋째 아들 균(뒤의 선조)을 후사로 세운다.",
    "sources": [
      "『명종실록』 권34, 명종 22년 6월 28일(신해) 1·2번째 기사"
    ]
  },
  {
    "id": "yi_era_e006",
    "figure": "yi_sunsin",
    "year": 1575,
    "text": "김효원과 심의겸이 맞선다는 말이 그치지 않자, 이이 등이 두 사람을 외직으로 내보내자고 건의한다. 선조는 직접 인사를 맡아 김효원을 부령 부사로, 심의겸을 개성 유수로 삼는다.",
    "sources": [
      "『선조수정실록』 권9, 선조 8년 10월 1일(임인) 1번째 기사"
    ]
  },
  {
    "id": "yi_era_e007",
    "figure": "yi_sunsin",
    "year": 1583,
    "text": "북쪽 국경의 번호(藩胡)가 난을 일으켜 경원부를 함락하고, 그중 니탕개(尼湯介)의 세력이 가장 거세다. 선조는 성을 지키지 못한 경원 부사 김수와 판관 양사의를 군사들 앞에서 효수하게 한다.",
    "sources": [
      "『선조수정실록』 권17, 선조 16년 2월 1일(갑신) 1번째 기사"
    ]
  },
  {
    "id": "yi_era_e008",
    "figure": "yi_sunsin",
    "year": 1587,
    "text": "왜선이 흥양을 노략하고 손죽도를 침범한다. 녹도 보장 이대원이 맞서다 전사하고, 조정은 그를 뒤이어 돕지 않은 수사 심암을 효수한다.",
    "sources": [
      "『선조수정실록』 권21, 선조 20년 2월 1일(경신) 1번째 기사"
    ]
  },
  {
    "id": "yi_era_e009",
    "figure": "yi_sunsin",
    "year": 1589,
    "text": "황해 감사의 비밀 장계로 안악·재령 등지의 역모가 보고되고, 전라도의 정여립이 우두머리로 지목된다. 조정은 선전관과 의금부 도사를 황해도와 전라도로 나누어 보낸다.",
    "sources": [
      "『선조실록』 권23, 선조 22년 10월 2일(병자) 1번째 기사"
    ]
  },
  {
    "id": "yi_era_e010",
    "figure": "yi_sunsin",
    "year": 1591,
    "text": "지난해 4월 바다를 건넜던 통신사 황윤길 일행이 일본 사신과 함께 돌아온다. 황윤길은 반드시 병화가 있을 것이라 보고하고, 김성일은 그런 정황을 보지 못했다고 보고한다.",
    "sources": [
      "『선조수정실록』 권25, 선조 24년 3월 1일(정유) 3번째 기사"
    ]
  },
  {
    "id": "yi_era_e011",
    "figure": "yi_sunsin",
    "year": 1592,
    "text": "4월 13일 일본군이 부산을 침공한다. 부산진이 함락되고 첨사 정발이 전사한다.",
    "sources": [
      "『선조실록』 선조 25년 4월 13일(임인)(권차 미확인)",
      "『징비록』 권1"
    ],
    "order": 1
  },
  {
    "id": "yi_era_e012",
    "figure": "yi_sunsin",
    "year": 1592,
    "text": "일본군이 충주로 들어온다. 탄금대에서 강을 등지고 진을 친 신립이 패하고, 신립과 김여물은 적 수십 명을 쏘아 죽인 뒤 물에 뛰어들어 죽는다.",
    "sources": [
      "『선조수정실록』 권26, 선조 25년 4월 14일(계묘) 16번째 기사"
    ],
    "after": "yi_first_report",
    "order": 0
  },
  {
    "id": "yi_era_e013",
    "figure": "yi_sunsin",
    "year": 1592,
    "text": "4월 30일 새벽, 선조가 종일 쏟아지는 비 속에 서울을 떠난다. 따르는 종친과 문무관은 100명이 되지 않는다.",
    "sources": [
      "『선조실록』 권26, 선조 25년 4월 30일(기미) 1번째 기사"
    ],
    "after": "yi_first_report",
    "order": 2
  },
  {
    "id": "yi_era_e014",
    "figure": "yi_sunsin",
    "year": 1592,
    "text": "5월 3일 일본군이 서울에 들어오고, 이양원과 김명원은 물러난다.",
    "sources": [
      "『선조수정실록』 권26, 선조 25년 5월 1일(경신) 7번째 기사"
    ],
    "after": "yi_first_report",
    "order": 4
  },
  {
    "id": "yi_era_e015",
    "figure": "yi_sunsin",
    "year": 1592,
    "text": "충청·전라·경상 삼도의 군사가 용인에서 무너지고, 전라 감사 이광 등은 각자 본도로 돌아간다.",
    "sources": [
      "『선조수정실록』 권26, 선조 25년 6월 1일(기축) 1번째 기사"
    ],
    "after": "yi_okpo",
    "order": 2
  },
  {
    "id": "yi_era_e016",
    "figure": "yi_sunsin",
    "year": 1592,
    "text": "선조가 서쪽으로 떠난 뒤 평양이 함락되고, 선조는 의주에 이른다.",
    "sources": [
      "『선조수정실록』 권26, 선조 25년 6월 1일(기축) 23·29번째 기사"
    ],
    "after": "yi_okpo",
    "order": 3
  },
  {
    "id": "yi_era_e017",
    "figure": "yi_sunsin",
    "year": 1592,
    "text": "여러 도에서 의병이 일어난다. 현풍의 곽재우가 군사를 일으키고, 광주에 살던 전 부사 고경명이 유팽로와 함께 군사를 모은다.",
    "sources": [
      "『선조수정실록』 권26, 선조 25년 6월 1일(기축) 31~33번째 기사"
    ],
    "after": "yi_okpo",
    "order": 4
  },
  {
    "id": "yi_era_e018",
    "figure": "yi_sunsin",
    "year": 1592,
    "text": "명 황제가 대군을 보내 구원하게 한다. 제독 이여송이 먼저 압록강을 건너고, 군사는 모두 4만 3천여 명에 뒤이어 8천 명이 더 나온다.",
    "sources": [
      "『선조수정실록』 권26, 선조 25년 12월 1일(정해) 4번째 기사"
    ],
    "after": "yi_busan",
    "order": 0
  },
  {
    "id": "yi_era_e019",
    "figure": "yi_sunsin",
    "year": 1593,
    "text": "제독 이여송이 1월 8일 평양을 공격해 이긴다.",
    "sources": [
      "『선조수정실록』 권27, 선조 26년 1월 1일(병진) 2번째 기사"
    ]
  },
  {
    "id": "yi_era_e020",
    "figure": "yi_sunsin",
    "year": 1593,
    "text": "전라도 순찰사 권율이 행주에서 일본군을 격파하고, 일본군은 패해 물러난다.",
    "sources": [
      "『선조수정실록』 권27, 선조 26년 2월 1일(병술) 8번째 기사"
    ]
  },
  {
    "id": "yi_era_e021",
    "figure": "yi_sunsin",
    "year": 1593,
    "text": "서울에 머물던 일본 장수들이 군사를 거두어 남쪽 바닷가로 내려가고, 이여송이 유성룡 등과 함께 서울에 들어온다.",
    "sources": [
      "『선조수정실록』 권27, 선조 26년 4월 1일(을유) 2·3번째 기사"
    ]
  },
  {
    "id": "yi_era_e022",
    "figure": "yi_sunsin",
    "year": 1593,
    "text": "6월 29일 비에 진주성 동문 성벽이 무너지고, 일본군이 성을 함락한다. 김천일·최경회 등이 전사한다.",
    "sources": [
      "『선조수정실록』 권27, 선조 26년 6월 1일(갑신) 5번째 기사"
    ]
  },
  {
    "id": "yi_era_e023",
    "figure": "yi_sunsin",
    "year": 1593,
    "text": "10월 1일 선조가 벽제역을 떠나 서울의 정릉동 행궁으로 돌아온다.",
    "sources": [
      "『선조실록』 권43, 선조 26년 10월 1일(신사) 2번째 기사"
    ],
    "after": "yi_hansan_base",
    "order": 0
  },
  {
    "id": "yi_era_e024",
    "figure": "yi_sunsin",
    "year": 1596,
    "text": "충청도 홍산의 서인(庶人) 이몽학이 군사를 모아 난을 일으키나, 부하에게 죽고 무리는 흩어진다.",
    "sources": [
      "『선조수정실록』 권30, 선조 29년 7월 1일(병인) 1·2번째 기사"
    ]
  },
  {
    "id": "yi_era_e026",
    "figure": "yi_sunsin",
    "year": 1597,
    "text": "7월 16일 칠천량에서 원균이 이끄는 조선 수군이 크게 패한다. 전라우수사 이억기가 전사하고, 원균도 달아나다 죽는다.",
    "sources": [
      "권10 「행장」(7월 16일)·「시장」"
    ],
    "requires": {
      "flags": {
        "arrested_1597": true
      }
    },
    "after": "yi_order_1597",
    "order": 3
  },
  {
    "id": "yi_era_e027",
    "figure": "yi_sunsin",
    "year": 1597,
    "text": "일본군이 남원을 함락한다. 명나라 총병 양원은 달아나고, 병사 이복남 등이 전사한다.",
    "sources": [
      "『선조수정실록』 권31, 선조 30년 9월 1일(기축) 1번째 기사"
    ],
    "requires": {
      "flags": {
        "arrested_1597": true
      }
    },
    "after": "yi_twelve_ships",
    "order": 1
  },
  {
    "id": "yi_era_e028",
    "figure": "yi_sunsin",
    "year": 1597,
    "text": "양 경리(양호)와 마 제독(마귀)이 울산의 일본군 진영을 공격하나, 일본군이 성문을 닫고 굳게 지켜 이기지 못하고 물러난다.",
    "sources": [
      "『선조수정실록』 권31, 선조 30년 12월 1일(정사) 2번째 기사"
    ],
    "requires": {
      "flags": {
        "arrested_1597": true
      }
    },
    "after": "yi_myeongnyang",
    "order": 2
  },
  {
    "id": "yi_era_e029",
    "figure": "yi_sunsin",
    "year": 1598,
    "text": "포로로 잡혀갔다 돌아온 사람들이 평수길(도요토미 히데요시)이 죽었다고 전하고, 전라 병사 이광악이 이를 급히 보고한다.",
    "sources": [
      "『선조수정실록』 권32, 선조 31년 8월 1일(갑인) 1번째 기사"
    ],
    "after": "yi_chen_lin",
    "order": 0
  },
  {
    "id": "yi_era_x003",
    "figure": "yi_sunsin",
    "year": 1608,
    "text": "정릉동 행궁에 머물던 선조가 죽고, 이튿날 세자(광해군)가 대신들의 다섯 차례 청을 받아들여 즉위한다.",
    "sources": [
      "『선조실록』 권221, 선조 41년 2월 1일(무오) 1·16번째 기사(16번째는 표제 '선조가 훙하다', 원문에 '薨' 자 없음)",
      "『광해군일기[정초본]』 권1, 광해 즉위년 2월 2일(기미) 1·9번째 기사"
    ]
  },
  {
    "id": "yi_era_x004",
    "figure": "yi_sunsin",
    "year": 1608,
    "text": "영의정 이원익의 건의로 선혜청을 설치하고, 공물 대신 토지 1결마다 쌀을 거두게 한다.",
    "sources": [
      "『광해군일기[정초본]』 권4, 광해 즉위년 5월 7일(임진) 2번째 기사"
    ]
  },
  {
    "id": "yi_era_x005",
    "figure": "yi_sunsin",
    "year": 1613,
    "text": "옥에 갇혀 있던 박응서가 역모를 고변하고, 광해군이 서청에서 직접 국문한다.",
    "sources": [
      "『광해군일기[정초본]』 권65, 광해 5년 4월 25일(계축) 6·7번째 기사"
    ]
  },
  {
    "id": "yi_era_x006",
    "figure": "yi_sunsin",
    "year": 1618,
    "text": "광해군이 인목대비를 '서궁'으로만 부르게 하고 대비의 호칭을 없앤다. '폐(廢)' 자는 쓰지 말라고 한다.",
    "sources": [
      "『광해군일기[정초본]』 권123, 광해 10년 1월 28일(무자) 3번째 기사"
    ]
  },
  {
    "id": "yi_era_x008",
    "figure": "yi_sunsin",
    "year": 1623,
    "text": "3월 13일 인조가 군사를 일으켜 왕대비(인목대비)를 복위시키고, 대비의 명으로 경운궁에서 즉위한다. 광해군은 폐위되어 강화로 쫓겨나고 이이첨 등이 처형된다.",
    "sources": [
      "『인조실록』 권1, 인조 1년 3월 13일(계묘) 1번째 기사"
    ]
  },
  {
    "id": "yi_era_x009",
    "figure": "yi_sunsin",
    "year": 1624,
    "text": "부원수 이괄이 금부 도사와 선전관 등을 죽이고 군사를 일으켜 반란한다.",
    "sources": [
      "『인조실록』 권4, 인조 2년 1월 24일(기묘) 3번째 기사"
    ]
  },
  {
    "id": "yi_era_x013",
    "figure": "yi_sunsin",
    "year": 1645,
    "text": "4월 26일 소현세자가 창경궁 환경당에서 죽는다.",
    "sources": [
      "『인조실록』 권46, 인조 23년 4월 26일(무인) 1번째 기사"
    ]
  }
]
