[
  {
    "id": "so_era_1",
    "figure": "sample_other",
    "year": -3,
    "text": "목부족이 겨울 목초지 다툼 끝에 이웃 고을과 임시 경계를 정한다. 경계는 강변의 버드나무 세 그루로 표시된다.",
    "sources": [
      "가상 데이터 — 실제 사료 아님"
    ]
  },
  {
    "id": "so_era_2",
    "figure": "sample_other",
    "year": 3,
    "text": "남쪽 강이 범람해 강변 고을 여러 곳의 논이 잠긴다. 관아는 이듬해 세금을 절반으로 줄인다.",
    "sources": [
      "가상 데이터 — 실제 사료 아님"
    ]
  },
  {
    "id": "so_era_3",
    "figure": "sample_other",
    "year": 8,
    "text": "북쪽 목부족에 새 족장이 선다. 새 족장은 강변 고을들과 소금 교역을 늘리려 한다.",
    "sources": [
      "가상 데이터 — 실제 사료 아님"
    ]
  }
]
